,teste généré
0,and class members creepy from century reality century care caught was and doesn't william house you decent makes from and movie and make century appreciate course is five and to rate from lack usual familiar from in and strong sad a dialogue can and movie and gets century strong team to william dog didn't on horror ending 1 a whose a and to make excellent believable from in and however caught century a movie your american from and instead to a movie century and hold surprised to caught almost dancing world and to can there's a caught century liked from century middle from in gore a none for 2 with century along from expect from and writing from creepy rather century female manages familiar goes became century believable a movie century james caught century place there's a movie and century century century from years from images a william boring from my and dialogue care from and to group make from movie make william trying seen subtle world century on movie and 2 to daughter actor a edge eyes and edge century century on and turn together as and course shown excellent along william from movie poor 2 a james hold
1,care less parents gore a days surprised plus from and caught least perfect city along a strong a strong caught from kind william team british in portrayal expected a please a there's animation century james makes years century care western from century takes her familiar century sad century a expect subtle and william hold 1 again from and working sad first from and appreciate from century century a to on william 2 perfect entire a touching century looked there's and meets a american century book a light from first century movie 2 no makes can century frank james against didn't make william a to piece from and and william to and to both things and strong to movie movie and caught impressive care creepy party wonderful animation from century a getting there's century from james from and strong to a get as there's there's and strong caught a eyes crime to john expected song from doctor century from caught a talented a behind usual century each dead clearly a to car 2 caught to 2 a strong from century a to william cannot can is and didn't a to where century miss dramatic century a people and piece william friend
2,there's is caught as his can seems things century a to drama as and william expect george dog care a and hold actor 2 type to roles from and romance images caught looked friend from and to another caught doesn't turned light a 2 are century was on century from century caught to 2 couple run superb along a century century movie his century from main from on going a century a house team along all wonder gore these to white had expected century your ending century theater didn't william expected a world someone century are miss make and james car a beginning almost all century century living century century ones portrayed for and dialogue them type century during from and laugh care century almost james no flick from fine from and doesn't from dancing from writing from and dancing add creepy entertaining almost city james from and dialogue expected and caught from creepy viewing a great for your century century turned from years 4 could fast years a movie and movie another quality start from in and fan can from going century century love and b to william century caught both and strong from liked to away james from
3,on and years from make romance movie and along a and and to first funny and edge century from years films century yourself caught from century to william james from horror unlike and to beginning could released less century from run to entertaining can david team century a strong car from expect care your writing soon is and strong on and caught u late 2 hold care makes and william century century expected a funny century moves a makes world from 2 century a dialogue and to and another century from i'd century century a strong and called takes wonder a laugh team and hold u century century a 1 expected actor caught is on and unlike middle century works perfect dream seems main a and to john parents from and to william dancing a 2 century century from late to main expected century yourself events sad century from and horror disney doesn't things century century and to on to william century from in doesn't is romance and strong horror century to movie and caught to house and john actor and rest just and called miss along years caught a clearly are both romance a to caught 2 from in
4,escape guys years from b type see expect as century from and on william effort movie century to 2 world from and century david make and movie example sad hold a caught a none century creepy century subtle especially men eyes funny century overall from and real watch a strong your movie year your from and class expected creepy team make from and turn is them century from and on example see and group from and takes to a strong this william and perfect care from friend from and to 2 quality things wonder from excellent animation 2 was and to drama william century dramatic on take a century century first writing from wonder century a movie and john from century to subtle from to light james original a none a john there's and william car western from talented you've from and watch five team century caught alone years etc familiar looked years find b writing century films century james team century century looked century a talented boring and thing century from as and there's from original had century caught james there's century a turned to excellent century from serious a excellent caught caught century century to mark 2 century
5,along century dead perfect a on time are and almost caught from and century horror and late and to william a to yourself are caught along wonderful is william and fascinating century my parents as and to caught world and type to group century each main world hold a to there's 2 from on and example from 2 dancing and to on century william century entertaining main a how living a dialogue century century a john century enjoyed 2 from others didn't century and american around escape century a william from nice horror wasn't to and paul 2 james writing and hold eyes strong first take century a 1 run for and caught dancing them and son had from and main century from and class from wonder century century sequences century a fast sad a to group from in and movie on and caught herself from in strong from original century a and great shows earlier for written type excellent can all main from people david strong century century from perfect is run century century from hold from happens from lack interested from years entire century touching to against run world century to on case hell needs looked hold from
6,and both certainly gets william a to on and romance care care century from and movie particular quality caught from and to a william and to movie and hold age are and movie century caught century lack from years stay from century watching different and 4 care creepy miss century a sense guys here caught a caught from century and type less from makes and 1 for own called events from and movie song william from century a 2 herself century century care head in his and appreciate century century wish from of didn't themselves particular century century from laugh world documentary both interested century care a strong a appreciate care to piece a century to lack dog your on and to can century from century edge type century a appreciate from and to takes century century average century in and to george george them and journey care century care light from william didn't is character as and use from century no reason older example william a james run creepy hold doesn't goes from and to yourself from them century caught theater james a created cop single years to group doesn't didn't all century from and to another appreciate them
7,a to a strong person william a getting to caught he and as actor and edge from and to caught century as and movie herself on and minutes get century 4 a to doesn't documentary them there's century james from and romance beyond you century dream guys 2 there's century 4 entertaining century joe shows gore from and dvd less does funny caught a caught from years caught century light from sad on didn't century them like century didn't from and caught miss century century century a dialogue to disney make as expect light stay a and strong from eyes a dialogue expect from due see familiar century friend sad a called and to young century from and to a dialogue from how can shots for clearly a movie and john give animation is animation from year gets i'd for and touching could disney perfect eyes make ending and caught a crime caught century along caught a to viewing century surprised world and dialogue could all and along from and william was both a take expected from clearly century care century a in century your once is liked from and type from in hold dead things century century a eyes
8,getting films years century a hand whom a to doesn't comic from century from century a and to john james can caught care both from and class from century care james world from years and century era get century century to appreciate overall from didn't romance soon team make from on deep century to a comedy century from fast from hope least century personal entertaining there's from james your crime make a strong century them from silent see on fast writing century dialogue a to laugh i done century along century from horror as movie your to caught eyes a century you and dvd paul supporting takes could run caught comedy on and perhaps william creepy century year and romance a and and caught a movie and romance to escape saw simply from and to william century a movie william world a bill team to william on days thanks from than for strong 4 hold from horror century from in interested a sad makes first william century 3 shows years on to caught century from century a talented a lead to years world century a level classic them and non james from and natural from original from william century from
9,and to movie instead piece you century from and 2 from can david her and laugh from disney from in working you'll century along years century a to car pace believable for expect from and in 2 blood from and caught century pace a in century isn't movie century 1 from century care along all his can william doesn't all first and william book century moves a late world william from piece century century beyond caught a others is romance takes hold james from and reality from takes is people things believable a dialogue from are and to and john animation as oh images on century a laugh hear type century all perfect doesn't expect and eyes didn't and totally takes doesn't light and run run quality century a episodes took surprised gets and to days own and dialogue century 2 a john to romance from on and people century from in william second supporting a movie hold from on and caught future a john century light mark saying and where are western dream caught to century a william care james century care a isn't there's late century century shows on american comedy late century william a turned from 2
10,my and 2 sad from on first along things familiar to frank james a dialogue a 2 dancing century creepy care are late doesn't writing didn't almost all and to escape there's none century a working guys surprised hope theater caught quite 4 century joe century dream hold supporting son from william century ending can and strong care are in century i and women a comic century first a 2 political and 2 star make stay typical b years main century writing along a group to away caught century less century movie almost middle william a john song from on doesn't around all for and to william in 2 century century to century dog along there's for and dancing caught caught a talented a to and 2 young gets animation a clearly from creepy world and frank always century care from on started caught caught caught to portrayed from a comedy century century along a and people takes from example make from and to and george century no can caught century mention a strong others strong william along william wish from in talented saying situation could sad from century from on takes working looked wish to a and edge fan
11,your horror is character let from and crime along from takes case hold a shows horror from clearly century friend century a across from william horror century entertaining your a instead and piece william century entertaining james soon supporting lack caught entertaining years century average a william could century a century world how how interested a movie you romance worked a there's can example together is and type to william from convincing is and shows there's is dead century type from century wish a and writing to how there's team creepy a liked and please century 2 years a instead care could excellent viewing from and wonder century first caught there's is and to and william can a george expected creepy both from and wife sad excellent all how a and take could word century from and group from takes century care century world animation all in funny matter to and to year their viewing a gets and called from to movie is and fan to and caught takes from and to a strong caught along from caught from sad overall a escape female type century gave red older gets cop hate disney a world first 4 turned is and
12,strong are caught a william expected world all and working world century william against a and on is and could caught from and john from jokes to 2 from plus a and great there's 2 from can for world for to there's expected care example century from viewers and 2 century type are alone caught movie year older 4 4 and edge caught there's how make from century run world as century james watching how and clearly century a obviously to people outstanding century joe from does truly hold care wish team from take are on escape friend average down century a strong together century to late from along william care from shows went late from century caught a above william from wonder century against from world david a caught century a movie and there's century care first william make animation soon a and then stay century you and least william there's all and set century entertaining clearly and dialogue car main century to century century miss strong along is gets a caught expected from in horror a to looked there's against cannot comedy entire gets and movie and actors century and thing except from great course and group dialogue
13,quality century a and on 1 beginning them a funny from in caught from main lead along example william looked from make and storyline takes as and to and sad century creepy from century to a caught female to caught about century a hope on caught didn't century from in movie year how and caught century from and romance images them william usual guys and everyone looked effort creepy along there's wonder from century to i'd your century film and crazy beginning things writing century to turned to friend around lack century care a and movie and dialogue works them from century a 2 white word 2 entire care run for and makes is have century century from see and particularly living make how william team century team wish from and romance 2 from century didn't subtle care 2 from clearly i james from and his on how wonder caught care century italian all in slow caught takes century century century interesting western are hold women romantic world acted didn't score a romance from perfect century care from different all and example soon william your dog care from and hours images perfect a movie drama adventure from sad older down
14,learn care to hand less sad to minutes on and case sad century from century a edge a movie down moves from along century believable for and called from and movie piece hold takes i'd was and simply care with rest century from century goes main world main a movie in century help disney a william a late about along is william from and dialogue them plot dancing james movie william 2 from american against a and james strong creepy and perfect horror a comedy ending down century a doesn't and william care century from wonder a seeing a are actor your from century called type century a familiar expected talent and others and to william dancing type creepy a hand night on again century a william from and to had car viewing for and run from in main a takes century century things excellent and to years is 2 caught care to and to and to century william from and strong makes all century as wonder women a century and called song make against years from on piece from sad from and appreciate to hand century piece william hold a are eyes own and movie car team century and
15,movie make and to a strong from william perfectly team care adventure entertaining enjoyed relationship living shown care century full on and and your including order future from and romance to to century william from william caught movie and hold care perfect from and to william century century to laugh century in 2 a takes there's a western century century a bill old from james force movie 2 is and to caught takes hold from and to william alone team a beginning from dead to caught average there's 2 a animation against comes lead didn't caught a century certainly can how british strong james along caught century century sad a working care all william piece word from century a shot from james william century 3 to caught sex on how century female theater all five a different century make from and almost caught from and caught caught word century there's is and there's george word along from century from movie behind a turned a horror from and to a to strong your wonder century to 2 and how edge century effort century believable entertaining from beyond moves on century your on a dialogue care from century along year from can
16,and year from along in william caught each animation and late how years century century miss a course funny sad william century century looked from perfect very piece century a movie century from perfect is actor from william care to and sad and talented i see years century century eyes overall from and william century quality team a turned law creepy as etc century hold from paul course on usual century friend to romance surprised to on and strong none a to yourself dog creepy a late yourself care could found a single lead about in and 2 from and william david them a didn't is 4 century from supporting care a performances there's and and william dancing care release effort turned older world years american william william movie minutes century william hands care shows see gets make a william personal expect century shows main william a to century old 2 for strong from expect to romance era for caught century a movie perfect had dog from script from hold care century is century takes from caught success care along a caught a appreciate a familiar from century 2 a romance from century your century to movie bill dead are
17,century century century a horror excellent and century care things century caught entertaining from light had from his and caught from century seen highly from and appreciate them rest century century century world all expect to viewing comedy animation there's and to great and called there's make light from can mean type a and takes make 2 for disney a 2 fan from expect century century care from and to william your can see and his escape quality century century a by however is caught from both and william car them on century care creepy care from and movie pure a caught to a to world century run century world entertaining from and first sad takes william directed rating from dream world all in century as and turn century all 2 important care century century from and movie and to group from century to 2 herself from and working makes all doesn't century care a life living could caught century your 4 team a century writing house eyes there's like wonder care perfect century william shows a his his on and called ending from and to young 2 light century along a and john there's takes century century a strong
18,and caught century first from makes single friend something william and yourself as century child century century looked a others understand to camera century a dialogue world william make and b from first how from century century pure party makes 4 to rest worked care writing wish on and start care a caught century entertaining to john from and word century takes century average care century care from century things 2 is poor things all how from first horror is caught from century a william to 2 my wonder strong century feel late from year music century fall century sad on and romance relationship both there's 4 from and strong car from century from and each from and thing are totally along is clearly from and real to and movie and to caught a caught from and funny others dancing comedy main to on blood didn't century century know century from clearly a william comedy there's caught obvious century century a alone year excellent century from century from how century a funny century from against caught gore story perfect to fast book western caught century from and appreciate century james could century century female almost all and background to movie
19,certainly is takes from century century a century century near strong goes century a movie didn't reality could century looked to clearly dog world and horror care and personal century creepy example dog a seen make make clearly caught looked from century world truly from century world pure a to movie horror a rest team from on and things to movie century century strong from and james from excellent and movie second lot and to a to mostly from and there's century and edge car and due a in to strong a caught from and another team from different world and to a type caught care from wasn't from and romance could make parents a movie minutes from can years a should average caught a movie found all century a john people from type from in how from year case from on and writing to how century joe a century from a a century ending william along familiar care from and excellent century a please century century from and to half truly first things are and to strong hell a fight world whom caught them on reality soon care to crime expected looked a caught party town from century care
20,is movie century no manages working for turn romantic about in romance a strong and taken from fantasy doesn't century century to course william to william a original from century care a 2 to caught as eventually for alone from century century care years hold older entertaining sad hero adventure see and rest to william caught along from western from and clearly adventure things talented a hold century there's western hold expected shows all years example didn't boring usually from in and movie living team century there's there's is movie and 2 your century takes less interested a and movie there's word a i'd there's is and fan them a strong century from 2 century 4 from main less my william from theater from and to emotions car things fear from century from both had can took a a s middle fight dialogue from bill dead care century james century due perfect there's a romance century creepy and dialogue caught from and movie young a caught does century is and century them lead century didn't enjoy social care soon a william century from light writing a clearly from people hold strong from moves world from william comedy on piece against
21,hope caught century from use had perfect is and william james and john car them from and class 4 james caught care team goes and different years there's caught century to a to playing a dialogue theater make and and fan sequence takes hold century a he's and to john century to yourself miss there's etc century a romance century stunning a caught had second gets subtle average book from in romance dog a strong run gore could perhaps to wasn't else from and century century from and to and viewing living century crime from and romance enjoy sad to whether william clearly creepy country a working entire excellent manages subtle a to other able dancing different directed from and to fast 2 events caught hero century creepy these and horror as century caught century 5 century care shows years make century them first his wonder william from in minutes william a strong herself from along from a miss from william from people from and movie entire working from century century a laugh and called ending book century was didn't a great year american and family years takes and to young century along a dialogue a against william your escape
22,century her frank obvious from run reality years days as century from disney to release there's lack level 2 cinematography a and again excellent century didn't there's second and william all example friend and to strong from and class a there's expected century care light sense action a portrayed together gets animation takes century from century a there's century theater is group from and to lead century a movie hand is william century creepy a to strong caught is another william care disney century eyes entertaining moments for world along both along century from as as them i piece century a to and living and romance century from a fan others from friend century from and dialogue to a years and girl to and james from century is clearly dog from on century impressive century from century a frank a start a movie dancing horror first david care care a gets sad care you've a and who them terrific century caught from and romance from and dog from century doesn't a on and quality century century things on there's lead a turned caught century from in caught anything and george gets perfect against a caught dvd 2 full political actor
