,teste généré
356,them david secret century from films together a called again and century to and a a to writing william a century along there's less from lead particular friend hold to on just from doesn't along century a strong from and on dog dancing century century a there's to movie strong a main a to and turn from and to caught 1 a there's living team from is and run 2 a century different 2 from century a 2 from and should gives takes century century james certainly including had expect century turned there's word overall from and movie thanks care creepy century entertaining female wonder care world from wonder century world can a to and caught from years there's is movie century a turn century first from century became a gave a western book richard to living team type light all wonder from to to group century 2 called from hold from doesn't country world century to century william does century things main miss older entertaining hold help subtle gets all james to a john to rest sad from century and to living writing these century make a there's there's there's writing a appreciate care town became to fast a
357,century james from and type actor eyes dog interested from original hold convincing effort along a and car doesn't century century living century a and famous hero house are william century creepy a against william and there's see late along a movie and crime care century boring century surprised from in awesome care william are century is and to caught century 4 from images these for caught along a and caught century a body from lead writing stay is william from world caught joe against soon a horror and appreciate century century century a previous doesn't animation s century century care caught example wonder had years both on of shown takes is century and please a sense century from and to and hope on sense on caught century along horror and movie hand on and john caught on and bill to how sad your along a didn't century a familiar type a strong and to rate could william year to funny century dancing a and usual from a movie along there's century from in and images 1 around century world from car 2 piece century century century entertaining a in italian dancing along you as and edge from perfect lead
358,from ways century from and seen is plot century writing century a strong from sad was on towards world century to didn't middle hold century year there's appreciate was frank caught care how still horror a clearly caught a caught actor a his century 1 creepy century is fear a late william from late is piece american is century from and working century century a both and nice again can william from better david from 2 century none silent older a years from piece century century century 4 looked james team showing gets western on on book horror average along goes from on working a world works strong caught century for william care watching shown and caught sad sad century a and enjoy own and caught along from and high century quality creepy century average entertaining james directed situations turned perfectly james making century rating joe entertaining looked to a of and time century from century ending along and group as century success century average century goes our from and start against along caught didn't try from and to 1 quality century and william to disney level a late works both as nature yourself supporting a gave century first from
359,in century century takes crime make from and turned century care from century care looked familiar from ending political from century first and supporting from creepy century see light red interesting year a and caught 4 creepy joe a others herself first for put piece century from and movie another quality care eyes a movie and moves care creepy silent your friend comic a social usual from world and working team a strong case different years clearly a to and fan from perfect and hours team and edge a movie put and crazy century from and to turned is century from century century a cannot turn late them dog convincing western on cold a caught a by caught america believable could silent and light expected horror there's and single to dog from and to years make my century a movie and to caught century century takes reality from take is and with excellent documentary caught to and strong late team his across all on caught from 2 century a 2 against bill eyes wonder from century from and to young didn't all and there's book century from century a to a fan living and familiar in and william william william
360,from in romance expected a to movie caught a strong type team takes make someone different a world get had and caught could century a dog expected creepy years century team sex century meet was makes a hope both for william a strong sex to years caught a james obvious western gets century team western james a to kids enjoy caught and dialogue towards stay can caught as century future william century care a century from takes is caught supporting could from century director there's years century team love a and seem to and movie william quality creepy 4 shows release convincing familiar entertaining from james political care b on movie entire goes and caught hold from on a to group own a movie car from in things themselves a william century century there's caught a less try eyes funny stay to great from up of sexual stay make against and strong just them caught along from in old a mark expected to a and to living them and to 1 from how and movie and 1 lady there's along turned james from on and on human there's stay them a movie and called care word interested expected from in
361,romance sci there's a caught care from in william from century crime a to william felt a romance piece against care along caught century for and romance get from caught world caught century from and to living sad a john caught from perfect caught friend james under a century second century from mostly older century a behind became century almost century care comedy century century famous make against for gore there's world world along guys century what's entertaining a average almost 2 and 2 sad to caught from are horror 1 from and century world century world see a lead james a and how a lead century gets james both william film and car century piece a dialogue from local is caught century excellent and edge watching them william there's century book dog from almost century a behind a how century century older my sense and nice century a main make there's from century didn't main from century her shown team a to a against certainly and movie relationship is and william century century entertaining century to believable years world dead century william from and working expected hold are events world from and let others is writing and to william
362,images can and up and william century a hand century give clearly from century only all stay century are century change team 3 are on soon sad takes country care from william care to romance century william a century james theater a natural terrific to and century hit didn't a movie and american stay century along from start century care along horror strong a and edge star and william to william touching to strong sex years from century care them on none hit to wonder century creepy average century years at in and another wonder from of to called stay in and movie william takes century on and perfectly i'd your them century century sad from writing make 2 guys there's century from and comedy less sad century emotions century years from edge friends average a century miss creepy years gets a points are ending comedy type century care century a on between them had things along from for 2 from going america from them lead from william care a and does george first dr century turned a strong and group care talented from in william james from century century creepy cinematography from william century another if doctor james from
363,caught run care and romance actor real and eyes gets viewing from and on actor takes century a turned from and edge care from wonder start creepy caught from years from and laugh from light a and caught actor and start hold with and great white quality them century from and was and caught from hope takes unfortunately century care from in romance could does century century from b thought gore beginning a a 2 takes james horror william are familiar horror all type century century takes a a writing and funny edge century century all century a caught from strong for silent century century is late james help them century century gore a turn others 2 certainly to joe century century to and actor viewing along make can and caught care first and strong beginning creepy for make decent help perfect century yourself world and see a caught century i'd from in there's care a are and to william a to a example from how from in 2 and to movie and romance from century dog from and there's actor a romance to a movie william century century care performances century a turned hold creepy five from century single
364,takes interested under party is and run from century your please from death face a romance poor a between century silent hold dream century on years from william world happens from in and group together could takes make dog a 2 century looked creepy both from and horror up makes caught along 2 world century century a turned century sad there's century a review a 2 working world and to different there's william red from and fast caught first from stunning particular a strong from make william from and girl from a and era caught from 2 from expect from in and relationship not and world from how 2 a 5 and to strong word 2 there's century care called from interested to alone from in century takes is and piece a how from william a and william there's all no 2 didn't is and william william are down century hold song a bill to william became overall beginning leave care entire on towards stay entertaining in there's hold a turned given late team century a strong wouldn't along emotional century james late from there's all both pace from laugh from crime effort these enjoyed entire to gets make caught
365,century on world from friend from better along excellent century care from and excellent your make century type sad stay a years herself caught didn't caught a western from century is 2 main soon there's a along a william book and 1 beginning crime from century a dialogue gets type caught care your little and sort particular first 2 make example century a and on other and william appreciate eyes century from romantic to late from understand from 4 and movie minutes century a bill almost century turned wish a laugh and to james enjoy can on on didn't there's is william from both 2 is caught is and to hand 5 from years make word as and group lead watching century a romance a to to great things how familiar care century a strong from and dialogue see both takes can century hold i'd there's make seen older your all william century from something there's to and to viewing score century a caught her creepy there's a strong sad older to on giving world a talented miss town years from clearly century working run expected century a to didn't century ago portrayed year century a late certainly western word
366,older a viewing between movie hold a created from century james from in light again all and movie just takes and john to working sex william caught from century a and s whom least woman a other century make william and edge give all caught a start 2 from hands century familiar supporting to and years 2 from takes moves caught a on and romance takes eyes 2 century james a and to john gets and clearly william does and and father gets is romance century from caught a william a particular century on and hold could all caught and caught didn't on viewing shots hope dog eyes a 2 works gets century didn't william century from on ago from century along from and to william comedy century along a cut from example a hate century could caught personal from century ago a caught a horror than paul western a alone could 2 and dialogue and fascinating from caught and clearly from william a to days hold wish goes country care brought a romance 2 party a 2 century a movie stay original is fan a john documentary along writing from bill a none perfectly entertaining caught wonder a talented
367,from clearly there's century dead older century light gets manages from done along a movie caught from and to terrific from takes and type caught creepy to along and writing from and to years a alone from years on alone you strong to doesn't female crime a horror original above caught stay sad beginning light century friend plot century reality miss century a behind and 2 surprised face along is and edge takes strong century from century from perfect from 4 can and strong century parents and group book first light century dream from western sad care years a how actor century to 2 from and movie days hold care century century from james frank shots century doesn't a 3 kind is century to none takes along is clearly others james cannot reality type interesting believable soon from silent century caught from on cannot viewing not caught course century from first century century from james goes century a to william and there's century full your century joe takes what's to another animation their perfect century century business enjoyed on on movie course writing caught to there's all and caught and particular your less to william a please 2 from as
368,memorable century from late and 1 things all horror silent from for century effort care understand can years was william care a strong team stay creepy a on and things takes make hold century century looked shows a course make 1 viewing century century from century care creepy a jokes themselves william a called quite a strong on on in and group for and to drama caught century century care all 2 older makes 2 expect world william a william expected along stay century century movie expect a can america takes a didn't strong expect along century along william from and girl and there's caught century from in romance century care your on century care from personal see 2 writing care are and can caught a main century 1 to movie and there's are along and dialogue century type a almost themselves caught a william care american light and romance as dog stay female older together is william a didn't example century western creepy are and been dog could supporting james team interested to isn't is and william a natural movie and dialogue from movie own years friend dance from i'd no david strong soon caught entertaining song true working
369,century care century are romantic and group to 2 from and to how from wonder century a level from how from expect sad from century from century a william a created a movie make thing is and didn't a there's century a and edge doing james cast dog james all as and movie and dialogue team u dancing from and adventure dialogue from years and to writing from year all can a dialogue a 2 a strong actor from william things century to didn't a escape to please century from silent my created a talented looked party gets my stars hold called world on and late century there's years is century from piece from on century a laugh expected century laugh is character from how william care century from and to level could wonder make century from and things to caught dog from and rest century american and clearly miss century guys caught 1 century from bill make william average stay from on people and take for piece your century care century to please a didn't century care from hold moves films laugh a take living care for silent learn sad years from and to strong for them century century
370,about and strong make and another nice there's century none care shows all and seen just from century miss century care both comedy name is and music caught from on and james beyond expect had comedy century child a was and romance expected century creepy century comedy years a strong hold from and to in fan no david century a edge a make a hand as along is world average kids team century a turned world lead a dialogue william there's a family from and edge century expect from cop a his soon them and romance from and edge rest and air to 2 hold entertaining william gets western however all instead particular make fast world a and to century hope strong single a strong surprised perfect century brings perfect members care perfect gets century century a let 2 william century century paul sense from and year for his 4 as and romance a fascinating century a appreciate from years course all team for takes in and caught didn't century from ending hand wish from hold a behind from on interested century around as and 1 miss everyone your i'd reality gore a caught stuff disney both main subtle 2
371,are horror is william century century century entertaining from fi wife a on takes there's as caught a strong there's brings care older love parents goes stay book century caught century from drama are liked about and ending from and to young original animation a movie century a called hold middle century and away century didn't a john rather there's a along five from perfect is writing rich care writing great and and movie does hold didn't century turned a on parts make them there's your caught century from century a to run century friend party a william william creepy century joe century along moves looked ending all in hold run acted from both horror is and fight from takes from in romance around william along century turned to and caught to getting century make century team making years from make type saw believable from century care help caught from fascinating to 2 a called world along a nice from in william to people example from century century care dream sense william interested century horror century can century caught manages world a take lead how takes all alone james perfect horror to clearly working william caught from and to and
372,john watching type century from century from hope to star hold get william century a john herself entertaining to first a solid from caught from and strong from seen william century a strong century from in them a movie can from course moves care from in wonder maybe stay 1 world and strong to mostly horror their caught century century from in william didn't caught as century caught world disney interested shown country a family century surprised for is all william overall your century century century century are and doesn't i'll from caught single century to eyes james james century century century run perfect a age expected century is william was james make expect didn't created to on than james century friend a there's a caught william century became century believable world from reality there's a william didn't william caught a others and please century perfect from and movie and to of original anything century century and turned to thing funny hold strong a talented expected female from lead police world living james century is and on hope from nature from them from and dialogue century silent stay expected entertaining hands from and world century as century james team from
373,and to lead century strong team century a romance a won't caught century caught century song a awesome yourself events to late century from century make from 2 from shown care viewing caught a fi herself creepy see deserves add comedy all reality a late century william from in friend make and caught 2 a adventure and and william images joe entertaining along enjoyable to and writing excellent all their terrific and to and john william century james from in romance surprised does century guys edge story and mark year 2 from make from century sex century care is talented together both century a william using from rest less hate from first old there's a getting century and john century caught are turned to and to 2 a romance century from century century gets years a living to second making lack strong didn't course perfect to movie william william caught western from and hand second all in always turn team century a bill a how william century are and to great type didn't animation your william care a western to 1 william world century a days book century james from century parents entertaining from century jokes comedy b york main
374,century became for fan lead type 2 your a movie are piece century a group and to living your can didn't can beginning century for movie romance william century century didn't comedy all interested working documentary you you coming as within from lack century hope dream ago perfect century caught care to in and group william william century shows years century care believable century care from at got from and working from and 2 team from century as and people lead on century century fi to others is emotions entertaining william century century to talented from on and there's certainly from and along from in century takes less to piece can and along as there's years and to didn't can word a caught from their and john hero eyes from dog from and to and similar a to james century from and to put william your example from and caught to his william does century world william and to mark william on dream old a movie and ending showing there's main century a start and horror century there's all on friend sad care century team older is first perfect example to and strong from century care could b a to
375,a 1 for hold from on century along a hand expected from that and called supporting century movie and to and to movie late another william from and to thanks didn't clearly century from bill and to sad than strong a dialogue from william friend takes horror century century seems 4 from western political care a to a william is movie century images sex perfect a against sad dead century century from century care century care year century from five gets century care a movie paul parents to dead average overall hell along average a shown there's caught a strong team from and slow care movie older world and level william from years not century years wonder world on and writing to turn a john from turn working along year was light from caught gets and strong seen and edge didn't shots light from 1 both and to 2 make 2 to caught from and touching to and william to william william a level and movie william than and century a to between viewing a caught didn't all century century a fear a first rate could caught against from successful a away works hold became from and against to sense
376,caught joe along see and dialogue book as strong century care years from and example takes them caught century entertaining century a there's is and century team could and edge james to there's century anything century from william care to interested and to level eyes looked and and young type type supporting team expect world animation care from and caught william along a there's usually from and doesn't century word your a to strong actor from century to shown from watching caught century didn't all makes turn as america a to caught surprised a 2 works from and didn't example century from william down on crime particular hope reality understand ending is and to funny your along century a turned care town while century century see century from and main type average you due 2 a both century care century a and had century a and between from and to and fan dancing century from years less to century century creepy a and car 2 moves a william from escape century a shown writing a 2 animation james future to memorable james caught century joe century entertaining joe a jokes was world how century period from gets century a group
377,and late from century a and main let could from and funny to there's yourself to and john is and too century from and strong to help fi for century a 2 caught type century century james perfectly horror animation century world shots looked a wish and how i'd century to awesome from silent caught care creepy eyes disney in and century century entertaining century century brings entertaining to same expect to william world william william a century era century a level century a eyes century william century wish from in didn't a caught ending century is and movie and piece age william from and gore david takes your david care from in and caught as first from on century caught a caught reality 2 than to whose moves due and group above first creepy william wish years a movie years word to and can to movie above and group 2 to escape expected from how happens expected didn't i'd female a got a years piece parents perhaps sad awesome see and to guess became takes from on world a strong and piece care almost and caught to a strong them century care century from and 1 2 century care
